paper,section_name,nchar,text,journal
205 Peter_et_al-2011-Geophysical_Journal_International.pdf,x.other.,159,"Seismology Tomography; Interferometry; Computational seismology; Wave propagation. Key words: GJI Komatitsch &amp; Tromp (1999), whereas applications involving",Geophysical Journal International
214 Geophys. J. Int.-2014-Retailleau-1030-42.pdf,institut.des.sciences.de.la.terre..cnrs..universitâ.e.joseph.fournier..grenoble..france,1317,"Institut des Sciences de la Terre, CNRS, UniversitÂ´e Joseph Fournier, Grenoble, France Accepted 2014 August 4. Received 2014 July 25; in original form 2014 May 27 SUMMARY = We present an analysis of the M 5.3 earthquake that occurred in the Southeast Indian Downloaded from  w Ridge on 2010 February 11 using USArray data. The epicentre of this event is antipodal to the USArray, providing us with an opportunity to observe in details the antipodal focusing of seismic waves in space and time. We co",Geophysical Journal International
214 Geophys. J. Int.-2014-Retailleau-1030-42.pdf,i.ntr.o.duction,5332,"1 I NTR O DUCTION computed in spherically symmetrical earth models at the same set Focusing of seismic waves at the antipode of a seismic source has of epicentral distances. However, the small number of stations used been attracting the attention of seismologists for many reasons. In did not allow these authors to investigate the details of the wave antipodal regions, seismic phases propagating trough the inner core focusing in space. can be observed, providing information about the structure of",Geophysical Journal International
214 Geophys. J. Int.-2014-Retailleau-1030-42.pdf,a.ntipod.al.amplificat.ion,3031,"3 A NTIPOD AL AMPLIFICAT ION To illustrate the antipodal amplification, we compare seismo- grams recorded at different epicentral distances (Figs 4 aand 5 a). Several phases may be detected at the antipode of an earthquake, The signals were averaged in different distance bins to increase the having travelled through the mantle and core, as shown in Figs 2 (a) c(""1032"", ""L. Retailleau"", ""et al."", ""Figure 2."", ""(a) Different seismic phases reaching the antipode of an earthquake. The phases travel ",Geophysical Journal International
214 Geophys. J. Int.-2014-Retailleau-1030-42.pdf,o.bservation.of.spat.ial,8065,"4 O BSERVATION OF SPAT IAL served PKIKP waves arrive nearly simultaneously and with same FOCUSING amplitudes at all stations (Figs 4 and 5 ). This is explained by the in- cident angle of the waves arriving from under the network (Fig. 2a ). In Fig. 4 , a considerable difference in the amplitudes between the A further study is shown in Appendix A. observed and the synthetic antipodal signals appears after 2500 s For all other body-wave phases, the amplification is clearly when the wavefield begin",Geophysical Journal International
214 Geophys. J. Int.-2014-Retailleau-1030-42.pdf,d.iscussion,11144,"6 D ISCUSSION When we consider the antipode as a main focusing point (point 1 in Fig. 7 e), the signals are well aligned and clearly show the Figs 8 Â­ 13 show results of the beamforming analysis for several minor and major waves (Fig. 7a ). After applying time-shifts based phases: PKPab , PP , SKKS, SKSP , PPS and SSS (see Fig. 2 afor on theoretical slowness of PP waves (Fig. 7b ), converging waves corresponding rays). arrive simultaneously and the resulting stack is very strong (Fig. 7 e). We ",Geophysical Journal International
214 Geophys. J. Int.-2014-Retailleau-1030-42.pdf,a.c.kno.wledgements,1128,"A C KNO WLEDGEMENTS 684Â­692. We thank Matthieu Landes for fruitful discussions. We thank Rial, J., 1978. On the focusing of seismic body waves at the epicentre's Alexandre Fournier and Tarje Nissen-Meyer for their help on the antipode, Geophys. J. R. astr. Soc., 55, 737Â­743. computing of synthetics with Axisem. Data from the TA net- Rial, J.A. &amp; Cormier, V.F., 1980. Seismic waves at the epicenter's antipode, J. geophys. Res., (80), 2661Â­2668. 85 work are made freely available as part of t",Geophysical Journal International
214 Geophys. J. Int.-2014-Retailleau-1030-42.pdf,references,2847,"REFERENCES because of the arrival of the waves from right under the network (Fig. 2a ). This implies that the waves arrive at the same time at Aki, K. &amp; Richards, P.G., 1980. Quantitative Seismology: Theory and the different stations of the network (Figs 4 and 5 ) and thus do not Methods , Vol. 1, WH Freeman and Co. Buland, R. &amp; Chapman, C., 1983. The computation of seismic travel times, interfere into a focalization effect. Bull. seism. Soc. Am., 73 (5), 1271Â­1302. Spatial snapshots ar",Geophysical Journal International
214 Geophys. J. Int.-2014-Retailleau-1030-42.pdf,x.other.,1126,"-wave phases strongly deteriorates and is barely observable. S Focusing of multiple a deviation of the energy focusing to the south, likely caused by the Earth's heterogeneity. )show PPS , SKSP . However, converted phases ( PP -wave phases such as PKP or P for the first snapshots of the signals and the beamforming results show that the focusing is well predicted http://gji.oxfordjournals.org/ performed over the different seismic phases detected at antipodal distances. Direct spatial computed for",Geophysical Journal International
223 Geophys. J. Int.-2013-Ristau-gji-ggt222.pdf,intr.oduction,12268,INTR ODUCTION stress analysis and analysis of apparent stresses shows how previous The Pegasus Bay aftershock sequence is the most recent aftershock large events in the Canterbury aftershock sequence influenced the sequence resulting from the 2010 September 3 UTC moment mag- Pegasus Bay sequence. Ground motions derived from strong-motion nitude ( M ) 7.1 Darfield earthquake in the Canterbury region of data for the two largest events are compared with the largest earth- w New Zealand (Gledhill et,Geophysical Journal International
223 Geophys. J. Int.-2013-Ristau-gji-ggt222.pdf,pegasus.b.ay.aftershock,92,"PEGASUS B AY AFTERSHOCK centre when available, otherwise the original catalogue epicentre is",Geophysical Journal International
223 Geophys. J. Int.-2013-Ristau-gji-ggt222.pdf,seq.u.ence,25115,"SEQ U ENCE used. Depth is solved for by calculating solutions over a range of depths to find the depth with the largest variance reduction between Overview the observed and synthetic waveforms. The Pegasus Bay aftershock sequence began with a M 5.8 earth- The focal mechanisms derived from the RMT solutions show w quake on 2011 December 23 at 00:58 UTC in the offshore region a high degree of consistency with the vast majority (45 out of c(""4"", ""J. Ristau"", ""et al."", ""Figure 2."", ""Top: Seismicity ",Geophysical Journal International
223 Geophys. J. Int.-2013-Ristau-gji-ggt222.pdf,discussion,11384,DISCUSSION well-defined NNEÂ­SSW to NEÂ­SW trend. (c) Cross-section through A-A . The overall trend of the aftershocks does not show a consistent dip in either The Pegasus Bay aftershock sequence is the most recent aftershock the NW or SE direction. sequence resulting from the 2010 September 3 M 7.1 Darfield w earthquake. The largest event in the Pegasus Bay sequence was a Coulomb stress change with the M 5.8 and M 5.9 Pegasus M 5.9 reverse-faulting earthquake and the kinematic source model w w ,Geophysical Journal International
223 Geophys. J. Int.-2013-Ristau-gji-ggt222.pdf,concl.u.sions,2970,"CONCL U SIONS Institute of Water and Atmospheric Research, Wellington, New Zealand, 46 p. The Pegasus Bay aftershock sequence is the most recent series Beavan, J., Samsonov, S., Motagh, M., Wallace, L., Ellis, S. &amp; Palmer, N., of aftershocks associated with the 2010Â­2012 Canterbury after- 2010. The M 7.1 Darfield (Canterbury) earthquake: geodetic observa- http://gji.oxfordjournals.org/ w shock sequence. Relocations using double-difference tomography tions and preliminary source model, Bull.",Geophysical Journal International
223 Geophys. J. Int.-2013-Ristau-gji-ggt222.pdf,a.c.kno.wledgements,1356,"A C KNO WLEDGEMENTS Department of Civil and Natural Resources Engineering, University of Canterbury, Christchurch, New Zealand, 24 p. Martin Reyners, Sandra Bourguignon, Rick Sibson, Phil Barnes, Jan Bradley, B.A. &amp; Cubrinovski, M. 2011. Near-source strong ground motions Burjanek and an anonymous reviewer provided valuable comments observed in the 22 February 2011 Christchurch earthquake, Seismol. Res. and discussion, which greatly improved this manuscript. Some of Lett., 853Â­865. 82, the f",Geophysical Journal International
223 Geophys. J. Int.-2013-Ristau-gji-ggt222.pdf,references,830,"REFERENCES damped linear elastic response spectra for periods ranging from 0.01 to 10 s, Earthq. Spectra, 24, 139Â­171. Abercrombie, R.E., Webb, T.H., Robinson, R., McGinty, P.G., Mori, J. &amp; Chiou, B.S.-J. &amp; Youngs, R.R., 2008. An NGA model for the average hor- Beavan, R.J., 2000. The enigma of the Arthur's Pass, New Zealand earth- izontal component of peak ground motion and response spectra, Earthq. quake 1. Reconciling a variety of data for an unusual earthquake sequence, Spectra, 24, ",Geophysical Journal International
223 Geophys. J. Int.-2013-Ristau-gji-ggt222.pdf,x.other.,201,GJI Key words: Earthquake dynamics; Earthquake ground motions; Earthquake source obser- vations; Seismicity and tectonics; New Zealand. characterize the source processes for the largest events. Coulomb,Geophysical Journal International
233 Schuberth_et_al-2012-Geophysical_Journal_International.pdf,a.c.kno.wledgments,1823,"A C KNO WLEDGMENTS derived from geodynamic considerations. Seismic heterogeneity is The authors are grateful to Diego Mercerat for fruitful discussions predicted from the temperature field of an MCM, which is converted during the preparation of this work as well as to Yanick Ricard and to seismic velocities and density using a thermodynamically self- an anonymous reviewer for constructive comments on the original consistent model of mantle mineralogy for a pyrolite composition. version of the ma",Geophysical Journal International
233 Schuberth_et_al-2012-Geophysical_Journal_International.pdf,references,1471,"REFERENCES graphic inversions. In this study, we used this approach to test the Alf`e, D., Price, G.D. &amp; Gillan, M.J., 2002. Iron under Earth's core conditions: assumption of a large thermal gradient in D and corresponding liquid-state thermodynamics and high-pressure melting curve from ab high core heat flow against the statistics of long-period P -and S - initio calculations, Phys. Rev. B, 65 (16), 165 118Â­165 129. wave traveltime variations. Comparing the geodynamic predictions Alf`e, D.",Geophysical Journal International
233 Schuberth_et_al-2012-Geophysical_Journal_International.pdf,x.other.,94934,"length scales relevant for long-period body waves. Key words: Heat flow; Composition of the mantle; Body waves; Computational seismology; Wave scattering and diffraction; Wave propagation. the mantle. Understanding the dynamic behaviour is important as 1 I NTR O DUCTION the flow drives plate tectonics and controls the way the Earth looses Long-standing questions in the study of Earth's deep interior are its heat. To improve conceptual models of mantle flow, the major about the origin of seismic ",Geophysical Journal International
24 bharadwaj.pdf,x.and.or.core..the.only.identifiable.benefit.here.is.that.the.extended.,68,and/or core. The only identifiable benefit here is that the extended,Geophysical Journal International
24 bharadwaj.pdf,x.array.data.set.can.reduce.the.acquisition.footprint.in.the.traveltime.,69,array data set can reduce the acquisition footprint in the traveltime,Geophysical Journal International
24 bharadwaj.pdf,x.bharadwaj..p...amp..schuster..g...2010..extending.the.aperture.and.increasing.,77,"Bharadwaj, P. &amp; Schuster, G., 2010. Extending the aperture and increasing",Geophysical Journal International
24 bharadwaj.pdf,x.the.signal.to.noise.ratio.of.refraction.surveys.with.super.virtual.interfer..,76,the signal-to-noise ratio of refraction surveys with super-virtual interfer-,Geophysical Journal International
24 bharadwaj.pdf,x.two.limitations.of.this.method.are.that.the.sources.and.receivers.,65,Two limitations of this method are that the sources and receivers,Geophysical Journal International
24 bharadwaj.pdf,x.must.be.mostly.inline.along.the.same.great.circle.path..and.the.ra..,67,"must be mostly inline along the same great circle path, and the ra-",Geophysical Journal International
24 bharadwaj.pdf,x.other.,45765,"amplitude information. Key words: Time-series analysis; Interferometry; Core, outer core and inner core; Body waves; Wave scattering and diffraction; Indian Ocean. and earthquakes with acceptable signal-to-noise ratio (SNR). Earth- 1 I NTR O DUCTION quake recording stations are mainly restricted to land areas of the Seismology Early seismic inferences about the Earth's deep interior were made Earth, and most are sparsely distributed except for certain areas, for by comparing earthquake records a",Geophysical Journal International
244 Spada_et_al-2011-Geophysical_Journal_International.pdf,i.ntr.o.duction,8178,"1 I NTR O DUCTION published on an international journal of Geophysics, in spite of Numerical simulations of glacial isostatic adjustment (GIA) have two remarkable initiatives in the last two decades. In the mid- an important historical role in global geodynamics since they are 1990s, a benchmark project for GIA codes was launched by Georg a key to constrain the rheological profile of the mantle (Cathles Kaufmann and Paul Johnston. Some results were collated until 1997, 1975) and help in the inte",Geophysical Journal International
244 Spada_et_al-2011-Geophysical_Journal_International.pdf,d.efinition.of.the.benchmark,30489,"2 D EFINITION OF THE BENCHMARK for future model development. Since some of the scientists work- CASES ing on this benchmark agree to release their numerical codes (and some are available already, see Table 1), we expect that scientists This benchmark study is mainly focused on the response of a lay- approaching the topic of GIA for the first time could benefit from ered, spherically symmetric earth with Maxwell viscoelastic rheol- this project. ogy to surface and tidal loads. This section descri",Geophysical Journal International
244 Spada_et_al-2011-Geophysical_Journal_International.pdf,m.ethods.a.nd.codes,13372,"3 M ETHODS A ND CODES in three dimensions or non-linear rheologies (Gasperini et al. 1992; Wu 1992). Wu (1992) described the first implementation of the For each contributor, here we briefly illustrate details of the methods GIA equations using Abaqus for a flat, incompressible, non-self- and codes employed. gravitating Earth. The Abaqus implementation was later expanded by Wu (2004) to an incompressible spherical, self-gravitating 3.1 Gs Earth with the SLE included. The Abaqus GIA implementatio",Geophysical Journal International
244 Spada_et_al-2011-Geophysical_Journal_International.pdf,r.esul.ts,41431,"4 R ESUL TS Figure 2.  = ... 4.1 Results for the wavenumber domain Spectrum of the isostatic relaxation times ,( j 1, , M ), j  expressed in years, for model M3Â­L70Â­V01 in the range of degrees 2 n  256, according to data sets provided by Vb, Rr, Gs and Zm (Test 1/1). 4.1.1 Results for Test 1/1 (isostatic relaxation times) = The number of modes is M 9, branches are labelled according to usual  = ... The spectrum of relaxation times ( j 1, , M ) for model conventions. j M3Â­L70Â­V01, displayed b",Geophysical Journal International
244 Spada_et_al-2011-Geophysical_Journal_International.pdf,d.iscussion.and.c.oncl.usions,10175,"5 D ISCUSSION AND C ONCL USIONS The analysis of spectral quantities in Tests 1/1 to 3/1 has shown a general agreement between the results obtained. Though the deter- mination of the isostatic spectrum of relaxation is not a straight- forward exercise and the numerical implementation of the VNM Figure 13. Polar motion (a), rate of polar motion (b) and LOD variation method differs between contributors, the results for loading and (c) computed for model M3Â­L70Â­V01 (Test 3/2). In all computations,",Geophysical Journal International
244 Spada_et_al-2011-Geophysical_Journal_International.pdf,a.c.kno.wledgments,867,"A C KNO WLEDGMENTS L06614, Geophys. Res. Lett., and the hotspots over the past century, 31, Argus, D.F. &amp; Gross, R.S., 2004. An estimate of motion between the spin axis community. 864Â­879. Geophys. J. Int., isostacy, 117, GIA research may also have a significant impact on the scientific significance of the incremental gravitational force in models of glacial cant improvements of theoretical and numerical aspects of the Amelung, F. &amp; Wolf, D., 1994. Viscoelastic perturbations of the Eart",Geophysical Journal International
244 Spada_et_al-2011-Geophysical_Journal_International.pdf,references,4130,"REFERENCES lytical and numerical techniques. Since some of the participants make their codes publicly available (though the documentation Abaqus Analysis User's Manual, version 6.7, 2007. Dassault Systems. www.simulia.com (accessed 2010). is sometimes missing or poor), we believe that these signifi- Amelung, F. &amp; Wolf, D., 1994. Viscoelastic perturbations of the Earth: cant improvements of theoretical and numerical aspects of the significance of the incremental gravitational force in models ",Geophysical Journal International
244 Spada_et_al-2011-Geophysical_Journal_International.pdf,x.other.,306,"satisfactory agreement between the results provided by the participants. Key words: Numerical solutions; Sea level change; Dynamics of lithosphere and mantle; Dynamics: gravity and tectonics; Mechanics, theory and modelling; Rheology: mantle. Zhong et al. 2008), to date no extensive GIA benchmark has been",Geophysical Journal International
246 Spada_et_al-2012-Geophysical_Journal_International.pdf,i.ntr.o.duction,8943,"1 I NTR O DUCTION follow the time-evolution of the Greenland coastal temperature and, The Greenland ice sheet (GrIS) stores an ice mass equivalent to a since the nineties, they are systematically negative. The maximum  - Â± - 1 sea level rise of 7.3 m (Lemke et al. 2007) and therefore con- amplitude is 267 38 Gt yr for the year 2007 (Rignot et al. - 1 stitutes one of the major reservoirs of fresh water on Earth. In the 2008b) (a loss of 360 Gt yr is equivalent to an average sea level - 1 Fourth ",Geophysical Journal International
246 Spada_et_al-2012-Geophysical_Journal_International.pdf,m.ethods,9865,"2 M ETHODS   where S is sea level change, is colatitude and is longitude, t is Since Greenland is recognized as a tectonically stable region with    time, and are the densities of ice and water, respectively, is i w low seismicity (Chung &amp; Gao 1997), we can assume that the present- = the reference surface gravity, G G ( h , k ) is the sea level Green's s s day uplift originates from two major components acting simultane- function (dependent upon the h and k viscoelastic load-deformation ousl",Geophysical Journal International
246 Spada_et_al-2012-Geophysical_Journal_International.pdf,r.esul.ts,57686,"3 R ESUL TS is a consequence of the larger energy contained in the low-degree portion of the gravity field spectrum. 3.1 Global elastic deformations in response In Fig. 4, a comparison is drawn between the uplift pattern ob- to current mass loss tained by the ICESat mass balance M3 of SÃ¸rensen et al. (2011) and that inferred by observations from the GRACE satellites. Among Figs 3(a)Â­(c) show the rates of vertical displacement (  U ), of rela- the various GRACE solutions so far published (e.g. ",Geophysical Journal International
246 Spada_et_al-2012-Geophysical_Journal_International.pdf,references,5345,"REFERENCES tano, G. &amp; Silenzi, S., 2011. Sea level change along the Italian coasts Alley, R.B. et al. , 2010. History of the Greenland Ice Sheet: paleoclimatic during the Holocene and projections for the future, Quat. Int., 232, 250Â­ insights, Quat. Sci, Rev., 1728Â­1756. 29, 257. Altamimi, Z., Collilieux, X., Legrand, J., Garayt, B. &amp; Boucher, C., 2007. Lemke, P. et al. , 2007. Observations: changes in snow, ice and frozen ground, ITRF2005: a new release of the International Terrestria",Geophysical Journal International
246 Spada_et_al-2012-Geophysical_Journal_International.pdf,x.other.,314,"deglaciation model and the ER associated with the new ICESat-derived mass balance. Key words: Sea level change; Space geodetic surveys; Global change from geodesy; Elas- ticity and anelasticity; Dynamics of lithosphere and mantle; Rheology: mantle. than one year, in some cases. The mass balances appear to broadly",Geophysical Journal International
248 spada j.1365-246X.2012.05663.x.pdf,i.ntr.o.duction,28669,"1 I NTR O DUCTION ocean-water density and salinity changes, does not imply any mass In a global change scenario, current sea level rise is perhaps one variations (steric contribution). It is now recognized that both the of the most debated environmental problems (see the IPCC Fourth mass and the steric contributions, beside varying the global mean Assessment Report, Bindoff et al. 2007). On the century timescale, sea level rise (GMSLR), also imply significant geographically non- sea level variat",Geophysical Journal International
248 spada j.1365-246X.2012.05663.x.pdf,t.g.d.at.a.a.nd.uncorrected,98,"2 T G D AT A A ND UNCORRECTED these recent observations upon the long-term sea level trends is, in",Geophysical Journal International
248 spada j.1365-246X.2012.05663.x.pdf,gmslr.estimates,33091,"GMSLR ESTIMATES our opinion, worthy of investigation. Despite the large annual (Willis et al. 2008), decadal and inter- 2.1 TG observations decadal fluctuations (Sturges &amp; Hong 2001), the D97 time-series shown in Figs 3 and 4 coherently denote a long-term sea level A broad review on the availability and quality of TG observations rise. The spatial coverage of this specific subset of TGs, shown during the last two centuries has been provided by Douglas (2001), in Fig. 2(b), strongly suggests ",Geophysical Journal International
248 spada j.1365-246X.2012.05663.x.pdf,g.ia.correction.o.f.t.g,89,"3 G IA CORRECTION O F T G considerably. Though barely visible in (c), in KL05 the melting",Geophysical Journal International
248 spada j.1365-246X.2012.05663.x.pdf,observations,22510,"OBSERVATIONS of Antarctica continues essentially until 1000 yr ago (Nakada &amp; Lambeck 1988), while in the other models it terminates between 5 3.1 GIA modelling and 4 kyr BP. In addition to the distinct viscosity profiles assumed, The GIA component of sea level change is evaluated solving the summarized in Table 3, these features have important consequences `Sea Level Equation' (hereinafter referred to as SLE). It reads: on the assessment of present day regional sea level variations. For , = ",Geophysical Journal International
248 spada j.1365-246X.2012.05663.x.pdf,d.iscussion,39090,"4 D ISCUSSION 4.1 A new, GIA-based selection criterion: the SGX set In Fig. 14(a), we show the rates of sea level change for 44 TGs v = for which at least N 60 yr of valid RLR annual records are min available. In the following, this requirement will be referred to as criterion (I) (the new or revised criteria introduced in this study are summarized in Table 4 and compared with those by D97). Criterion (I) constitutes a stronger constraint compared to its counterpart (1) of D97, which is based on",Geophysical Journal International
248 spada j.1365-246X.2012.05663.x.pdf,c.oncl.usions,3818,"5 C ONCL USIONS to be attributed to the assumption that the NA West coast and SE After a revisitation of previous work and an overview of the currently North America TGs are located outside the peripheral bulge of the available data, we have proposed a new solution to the long-standing formerly ice-covered regions. While this can be certainly assumed problem of the assessment of GMSLR from secular TG observa- for GIA computations based on model ICEÂ­3G, our computations tions. Although local sea",Geophysical Journal International
248 spada j.1365-246X.2012.05663.x.pdf,a.c.kno.wledgments,2773,"A C KNO WLEDGMENTS 2004. Estimates of the regional distribution of sea level rise over the Very constructive comments by Jerry Mitrovica and an anony- 1950Â­2000 period, J. Clim., 17, 2609Â­2625. mous reviewer have greatly helped to improve the manuscript. Das, P.K. &amp; Radhakrishna, M., 1991. An analysis of Indian tide gauge records, J. Earth Syst. Sci., (2), 177Â­194. We have particularly benefited from stimulating discussions with 100 Davis, J.L. &amp; Mitrovica, J.X., 1996. Glacial isostat",Geophysical Journal International
248 spada j.1365-246X.2012.05663.x.pdf,references,3961,"REFERENCES Emery, K.O. &amp; Aubrey, D.G., 1991. Sea Levels, Land Levels, and Tide Gauges, Springer-Verlag, New York, NY, 237pp. Aubrey, D.G. &amp; Emery, K.O., 1986. Relative sea levels of Japan from tide Fairbanks, R.G., 1989. A 17,000Â­year glacioÂ­eustatic sea level record: influ- gauge records, Bull. geol. Am. Soc., 97 (2), 194Â­205. ence of glacial melting rates on the Younger Dryas event and deep-ocean Barnett, T.P., 1983. Recent change in sea level and their possible causes, circulation,",Geophysical Journal International
248 spada j.1365-246X.2012.05663.x.pdf,x.other.,144,"). Key words: Sea level change; Global change from geodesy; Rheology: mantle. activity (mass contribution). The second, which is associated with",Geophysical Journal International
