paper,section_name,nchar,text,journal
304 Zhang_et_al-2012-Geophysical_Journal_International.pdf,x.other.,138,of surface topography with sufficient accuracy. Key words: Computational seismology; Numerical solutions; Wave propagation. Seismology GJI,Geophysical Journal International
307 Zhou_et_al-2011-Geophysical_Journal_International.pdf,i.ntr.o.duction,6883,"1 I NTR O DUCTION (Dahlen et al. 2000; Hung et al. 2000; Dahlen &amp; Baig 2002). To overcome resolution limits of traditional ray theory in seismic to- This approach encounters some difficulties for diffracted waves mography, finite-frequency theory, which accounts for wave diffrac- and triplicated phases. Finite-frequency sensitivity kernels may be tional effects, has been developed (e.g. Romanowicz 1987; Snieder obtained based on either mode summation (e.g. Zhao et al. 2000; &amp; Nolet 1987;",Geophysical Journal International
307 Zhou_et_al-2011-Geophysical_Journal_International.pdf,f.req.u.ency.dependent.phase,92,"2 F REQ U ENCY-DEPENDENT PHASE where denotes angular frequency, h ( ) the spectrum of the j ",Geophysical Journal International
307 Zhou_et_al-2011-Geophysical_Journal_International.pdf,and.a.mplitude.measurements,2424,"AND A MPLITUDE MEASUREMENTS j th taper h ( t )and the convolution operator; integration is over j  angular frequency . Surface wave phase anomalies are widely used in seismic tomogra- Correct to first order in small perturbations, measured phase phy to map upper-mantle elastic (wave speeds) structure. Measure-     delay and amplitude perturbations, ( )and ln A ( ), are related ments of surface wave amplitude anomalies have been used in stud- to perturbations in displacement via (Zhou et al. 2004",Geophysical Journal International
307 Zhou_et_al-2011-Geophysical_Journal_International.pdf,p.hase.and.a.mplitude.kernels,12371,"3 P HASE AND A MPLITUDE KERNELS  In this section, we draw connections between the frequency-domain  +   . 3 K ( x ; ) ( x ) d x (14)  theory of Zhou et al. (2004) and the time-domain adjoint method of Tromp et al. (2005) in calculating sensitivity kernels for frequency- The phase delay sensitivity kernels are defined by dependent phase and amplitude anomalies.    = F   K ( ; ) ( )Im s ( ) x  j j  3.1 Surface wave mode summation 1 Â·  Â·    -  , 2 ^ q G ( ) s ( ) h ( )d rx xs j  2 - In surface wa",Geophysical Journal International
307 Zhou_et_al-2011-Geophysical_Journal_International.pdf,k.ernel.e.xamples,14897,"4 K ERNEL E XAMPLES  1  We compare sensitivity kernels computed using surface wave mode     . i t f ( t ; ) Re f ( ; )e d (31) A A  2 - summation and the adjoint SEM for phase and amplitude mea- surements in 1-D earth model PREM (Dziewonski &amp; Anderson 1981). In the adjoint SEM, we construct the time-domain func-  tion f ( t ; ) defined by eq. (18), which depends on the synthetic  3.5 Wave speed and density sensitivity kernels seismogram in the reference model, the measurement frequency    To",Geophysical Journal International
307 Zhou_et_al-2011-Geophysical_Journal_International.pdf,surfa.ce.wave.sensitivity,90,5 SURFA CE WAVE SENSITIVITY lated using the two methods agree well except in small regions,Geophysical Journal International
307 Zhou_et_al-2011-Geophysical_Journal_International.pdf,kernels.in.3.d.earth.models,35343,"KERNELS IN 3-D EARTH MODELS around the source, the receiver and their antipodes. For major-arc wave trains, waves scattered in these regions may take multiple Surface wave sensitivity kernels in spherically symmetric earth paths and arrive at the receiver within the measurement window. In models may be computed very efficiently in global and regional to- surface wave mode summation calculations, only near-great-circle mographic studies using surface wave mode summation (e.g. Zhou paths have been",Geophysical Journal International
307 Zhou_et_al-2011-Geophysical_Journal_International.pdf,i.mplement.ation.of,86,6 I MPLEMENT ATION OF fundamental-mode surface waves at longer periods and larger epi-,Geophysical Journal International
307 Zhou_et_al-2011-Geophysical_Journal_International.pdf,anelasticity,12481,"ANELASTICITY central distances. In global fundamental-mode surface wave tomog- Sensitivity kernels shown in Sections 4 and 5 are calculated in purely raphy, measurement windows are often carefully chosen to minimize elastic earth models. It is well known that the Earth is anelastic, as effects of higher modes and measurements heavily contaminated by characterized by a seismic quality factor, Q , defined as the inverse higher mode surface waves are generally excluded (e.g. Laske &amp; of energy l",Geophysical Journal International
307 Zhou_et_al-2011-Geophysical_Journal_International.pdf,c.oncl.usions,10096,"7 C ONCL USIONS two simultaneous, independent wave propagation simulations. The We draw connections between frequency-domain surface-wave implementation of anelasticity may be unstable due to `undoing' mode summation and a time-domain adjoint method in calculating attenuation of the earthquake wavefield as the last frame of the sensitivity kernels for frequency-dependent phase and amplitude wavefield propagates backwards in time. We show that sensitivity measurements. The adjoint method is based",Geophysical Journal International
307 Zhou_et_al-2011-Geophysical_Journal_International.pdf,references,8514,"REFERENCES tion in the Earth: a review, Geophys. Monogr. Ser. , 117 , 161Â­179. Bassin, C., Laske, G. &amp; Masters, G., 2000. The current limits of resolution Ruan, Y. &amp; Zhou, Y., 2010. The effects of 3D anelasticity (Q) structure on for surface wave tomography in North America, EOS, Trans. Am. geophys. surface-wave phase delays, Geophys. J. Int. , 181 , 479Â­492. Un. , F897 , 81. Selby, N.D. &amp; Woodhouse, J.H., 2002. The Q structure of the upper man- Billien, M., L`ev^eque, J.-J. &amp; ",Geophysical Journal International
307 Zhou_et_al-2011-Geophysical_Journal_International.pdf,x.other.,202,Seismology Key words: Inverse theory; Tomography; Surface waves and free oscillations; Computa- tional seismology; Theoretical seismology. GJI body-wave phases based on kinematic and dynamic ray tracing,Geophysical Journal International
35 ebru j.1365-246X.2009.04468.x.pdf,i.ntr.o.duction,3240,"1 I NTR O DUCTION mathematical description of the model has the least influence. Al- GJI The global mantle structure has extensively been studied by seismic though damping plays a critical role in the final models, it is done tomography. With an increasing number of high-quality data in re- in a somewhat arbitrary way. The aim of our study is to establish if cent years, the resolution of the images has considerably improved. we can identify an optimally damped model based on comparisons Neverthe",Geophysical Journal International
35 ebru j.1365-246X.2009.04468.x.pdf,m.odels.entering.t.he,86,2 M ODELS ENTERING T HE seismograms was performed with the spectral element code (SEM),Geophysical Journal International
35 ebru j.1365-246X.2009.04468.x.pdf,cal.c.ulat.ion.o.f.t.he.synthetic,99,"CAL C ULAT ION O F T HE SYNTHETIC by Komatitsch &amp; Tromp (2002a,b). We selected four differently",Geophysical Journal International
35 ebru j.1365-246X.2009.04468.x.pdf,seismograms,8158,"SEISMOGRAMS damped mantle models (Trampert &amp; Spetzler 2006) which we su- perimposed on top of transversely isotropic PREM (Dziewonski We calculated SEM seismograms using four mantle models ob- &amp; Anderson 1981). We also computed synthetic seismograms us- tained for different levels of horizontal damping [see brown curve ing the independent 3-D mantle model S20RTS (Ritsema et al. in Fig. 1 in Trampert &amp; Spetzler (2006)]. The models were con- 1999), which unofficially is often considere",Geophysical Journal International
35 ebru j.1365-246X.2009.04468.x.pdf,m.easuring.m.isfits,5792,"3 M EASURING M ISFITS   &lt;&lt; sourceÂ­receiver pairs with distances between 20 160 .For body waves, we used less sourceÂ­receiver pairs because P, S and 3.1 Comparing real and SEM seismograms SS phases cannot be observed on all seismograms at all distances. We checked the agreement between real and synthetic seismograms We further restricted epicentral distances to have turning points by examining phase and amplitude differences. We compared 1374 above 2000 km, the maximum depth where our mod",Geophysical Journal International
35 ebru j.1365-246X.2009.04468.x.pdf,r.esul.ts,10632,"4 R ESUL TS time domain. We first applied time windows to extract the P, S and SS phases. The time window was defined sufficiently large around 4.1 Time-shift analysis the theoretical arrival times from IASPEI91 (Kennett &amp; Engdahl 1991) to capture the complete pulse. We Fourier transformed both For Rayleigh waves, the measured time-shifts corresponding to the seismograms and applied a Gaussian filter with a central period 60 s. four selected models m Â­ m are shown as histograms at sample 1 ",Geophysical Journal International
35 ebru j.1365-246X.2009.04468.x.pdf,d.iscussion,10334,"5 D ISCUSSION corrections as is done for S20RTS. These corrections are of the It is encouraging to see that the 3-D mantle models bring the syn- same order (up to 10 s) as the phase misfits for P, S and SS waves thetic seismograms closer to the observed data in phase, particularly (Ritsema, personal communication, 2009). While for surface waves so for surface waves. It is surprising, however, that quite diverse the crust is the most likely problem, for body waves these source mantle models canno",Geophysical Journal International
35 ebru j.1365-246X.2009.04468.x.pdf,c.oncl.usions,2273,"6 C ONCL USIONS REFERENCES indeed that the latter is of minor consequence. different groups obtained by different parametrizations, indicating NWO:VICI865.03.007. (2009) reported similar misfits for various 3-D models from et al. by the Dutch National Science Foundation under the grant number are most likely to be due to the insufficient data coverage. Qin seismograms were calculated on a 128-processor cluster financed disappear by a sufficiently strong regularization and discrepancies Network S",Geophysical Journal International
35 ebru j.1365-246X.2009.04468.x.pdf,a.c.kno.wledgments,2181,"A C KNO WLEDGMENTS We gratefully acknowledge the availability of broad-band seis- mograms from the IRIS/USGS (IU), the USAF/USGS (GT) and the New China Digital Seismograph Network (IC) from USGS/Albuquerque Seismological Laboratory; the IRIS/IDA Net- work (II) from University of California, Scripps Institute of Oceanography; the Canadian National Seismograph Network (CN) Figure 14. Histograms of Rayleigh wave amplitude ratios as a function from Geological Survey of Canada; the GEOSCOPE Network (",Geophysical Journal International
35 ebru j.1365-246X.2009.04468.x.pdf,references,3249,"REFERENCES 6 C ONCL USIONS Bassin, C., Laske, G. &amp; Masters, G., 2000. The current limits of resolution for surface wave tomography in North America, EOS, Trans. Am. geophys. We made quantitative comparisons between real seismograms and Un., F897. 81, those predicted by various 3-D mantle models using the SEM code. Becker, T.W. &amp; Boschi, L., 2002. A comparison of tomographic We observed that in particular for surface waves, the models im- and geodynamic mantle models, Geochem., Geophys., ",Geophysical Journal International
35 ebru j.1365-246X.2009.04468.x.pdf,x.other.,272,"amplitudes and have to be modelled properly. Key words: Body waves; Surface waves and free oscillations; Seismic tomography; Com- putational seismology; Wave propagation; Crustal structure. eismology S &amp; Lavely 1995; Becker &amp; Boschi 2002), suggests that the chosen",Geophysical Journal International
36 ebru j.1365-246X.2011.04970.x.pdf,i.ntr.o.duction,8474,"1 I NTR O DUCTION Seismic tomography is moving towards full waveform inversion by taking advantage of advances in the theory of seismic wave propagation, numerical techniques and increasing computational resources. We define `full waveform inversion' as a technique which combines 3-D numerical wave simulations as a forward theory with FrÂ´echet kernels computed in 3-D background models, to fit complete three-component seismograms. Full waveform inversions have been performed in local and regiona",Geophysical Journal International
36 ebru j.1365-246X.2011.04970.x.pdf,m.isfit.f.unctions.a.nd.associated.adjoint.s.our.c.es,30345,"2 M ISFIT F UNCTIONS A ND ASSOCIATED ADJOINT S OUR C ES We present derivations for elastic adjoint sources of our new misfit functions based on instantaneous phase (IP) and envelope (ENV) measurements. We also give expressions for adjoint sources of commonly used misfit functions of waveform (WF), traveltime (TT) and amplitue (AMP) measurements. In addition, we show how to construct anelastic kernels, following Tromp et al. (2005). All calculations of adjoint sensitivity kernels in the examples ",Geophysical Journal International
36 ebru j.1365-246X.2011.04970.x.pdf,r.esul.ts,15671,"3 R ESUL TS To understand the properties of the newly introduced instantaneous phase (IP) and envelope (ENV) misfits, we compare them to the more commonly used waveform (WF), traveltime (TT) and amplitude (AMP) misfits. The latter two should be used for isolated phases and waveforms of similar shape. They cannot easily be generalized to whole seismograms, and figure only in examples where isolated phases are concerned. We compute 3-D sensitivity kernels for all misfit functions using adjoint sim",Geophysical Journal International
36 ebru j.1365-246X.2011.04970.x.pdf,d.iscussion,9740,"4 D ISCUSSION All misfit functions determine their specific way in which particular measurements sense Earth's structure. Sensitivities for an isolated seismic phase, although not the same, show similar characteristics for all common misfit functions. For longer waveforms, different misfit functions exhibit quite different properties. WF favours the highest amplitude parts of seismograms only when a wave train is considered. The complementary IP and ENV misfits extract information from low-ampli",Geophysical Journal International
36 ebru j.1365-246X.2011.04970.x.pdf,c.oncl.usions,1712,"5 C ONCL USIONS We propose new misfit functions based on instantaneous phase differences and envelope ratios for full waveform tomography. We determine associated adjoint sources and examine their properties by computing finite-frequency adjoint kernels based on a spectral-element method. We compare the newly introduced misfit functions with more commonly used waveform, cross-correlation traveltime and classical amplitude misfit functions. IP and ENV measurements are a natural way of separating ",Geophysical Journal International
36 ebru j.1365-246X.2011.04970.x.pdf,a.c.kno.wledgments,713,A C KNO WLEDGMENTS We thank Anne Sieminski for her initial help with the adjoint simulations. Carl Tape and an anonymous reviewer provided constructive comments which improved the paper. This project was funded by the European Commissions Human Resources and Mobility Program Marie Curie Research Training Network SPICE Contract No. MRTNCT-2003-504267. Numerical simulations were performed on a 128-processor cluster financed by the Dutch National Science Foundation under the grant number NWO:VICI86,Geophysical Journal International
36 ebru j.1365-246X.2011.04970.x.pdf,references,4776,"REFERENCES Geophys. J. Int., 150, 440Â­466. AkcÂ¸elik, V. et al. , 2003. High resolution forward and inverse earth- Dahlen, F.A., Hung, S.H. &amp; Nolet, G., 2000. FrÂ´echet kernels for finite- quake modeling on terascale computers, in Proc. ACM/IEEE Su- frequency traveltimes Â­ I. Theory, Geophys. J. Int., 141, 157Â­174. percomputing SC'2003 Conference, published on CD-ROM and at Dalton, C.A. &amp; EkstrÂ¨om, G., 2006. Global models of surface wave attenua- www.scconference.org/sc2003. tion, J.",Geophysical Journal International
36 ebru j.1365-246X.2011.04970.x.pdf,x.other.,129,GJI Key words: Body waves; Surface waves and free oscillations; Seismic tomography; Com- putational seismology; Wave propagation.,Geophysical Journal International
38 Geophys. J. Int.-2014-Buffett-597-608.pdf,i.ntr.o.duction,7129,"1 I NTR O DUCTION gradually restore the field to the time-averaged state. This slow ad- Fluctuations in the Earth's magnetic field provide insights into the justment defines the deterministic part of the time evolution and dynamics of the core. Turbulent fluid motions regenerate the internal is often described as the drift term. The second part represents the magnetic field, producing a time-dependent dipole at the Earth's effects of short-period convective fluctuations. These short-period surfa",Geophysical Journal International
38 Geophys. J. Int.-2014-Buffett-597-608.pdf,numerical.simulation.using,98,2 NUMERICAL SIMULATION USING 3 is output every 10 time steps. A fixed (dimensionless) time step of,Geophysical Journal International
38 Geophys. J. Int.-2014-Buffett-597-608.pdf,caly.pso,3237,"CALY PSO  = Ã— - 7 t 5 10 is used in the calculation, so the axial dipole moment Numerical geodynamo models solve the equations that govern ther- - = Ã— 4 is recorded at increments of t 5 10 . We convert the solution mal convection and magnetic-field generation in an electrically con- to physical time by adopting a realistic magnetic diffusion time. We ducting fluid. The fluid is confined to a spherical shell, which rotates - -  =  = = . 2 1 2 1 set 1.6 m s , which implies 0.8 m s for Pm 0 5. ab",Geophysical Journal International
38 Geophys. J. Int.-2014-Buffett-597-608.pdf,s.t.o.chastic.a.n.a.ly.sis.o.f.a.xial,106,3 S T O CHASTIC A N A LY SIS O F A XIAL Stratonovich convention by evaluating D ( x ) using the mean value,Geophysical Journal International
38 Geophys. J. Int.-2014-Buffett-597-608.pdf,dipole.moment,8586,"DIPOLE MOMENT of x over a short time step (e.g. van Kampen 2007 ). In this case a gradient in D ( x ) contributes to the drift in a statistical description of The time evolution of the axial dipole moment, x ( t ), is approximated v the process (see Risken 1989 ). We use ( x ) to denote the effective by a stochastic differential equation e v v drift, although ( x )and ( x ) differ by only a small amount in the e d x v present application. To a good approximation ( x )isshifted in x = v + , ( x )",Geophysical Journal International
38 Geophys. J. Int.-2014-Buffett-597-608.pdf,p.hy.sical.i.nterpretation.o.f,86,4 P HY SICAL I NTERPRETATION O F uses the first and second moments of the distribution,Geophysical Journal International
38 Geophys. J. Int.-2014-Buffett-597-608.pdf,st.ochastic.model,25832,"ST OCHASTIC MODEL  Detailed output from the geodynamo model can be used to interpret = ,  = . Ã— 22 2 E ( x ) xP ( x )d x 16 2628 10 Am (21) the stochastic model. We begin with an equivalent definition of the - axial dipole moment, and  = ,  = . Ã— . 2 2 44 2 4 1 E ( x ) x P ( x )d x 264 7820 10 A m (22) = Â· Ã— , , x ( t ) ^ z [ r J ( r t )] d V (23) - 2 V c = Ã— 22 The first moment agrees with the sample mean x 16.26 10  = Ã— 2 22 Am , whereas the sample standard deviation 0.59 10 where J is t",Geophysical Journal International
38 Geophys. J. Int.-2014-Buffett-597-608.pdf,a.pplication.t.o.the,83,5 A PPLICATION T O THE variations in the dipole source for PADM2M and SINT-2000 are,Geophysical Journal International
38 Geophys. J. Int.-2014-Buffett-597-608.pdf,pa.laeoma.gnetic.f.ield,4371,"PA LAEOMA GNETIC F IELD - Ã— Ã— 24 24 2 1 2.6 10 and 3.1 10 Am Myr , respectively. These varia- Drift and noise terms have previously been recovered from palaeo- tions exceed the time average S . In fact, the relative variations for magnetic estimates of the virtual axial dipole moment (VADM). both models are close to 140 per cent, compared with 10.5 per cent The SINT-2000 model of Valet et al. ( 2005 ) was analysed by Bren- for the geodynamo model. Thus the Earth's core exhibits substan- del et",Geophysical Journal International
38 Geophys. J. Int.-2014-Buffett-597-608.pdf,c.oncl.usions,3473,"6 C ONCL USIONS core, in Geogmagnetism, Vol. 2, ed. Jacobs, J.A., Academic Press. We use a numerical geodynamo simulation to construct and inter- Jackson, J.D., 1998. Classical Electrodynamics, 3rd edn, Wiley. pret a stochastic model for the axial dipole moment. We find that Johnson, H.P., Van Patten, D., Tivey, M. &amp; Sager, W.W., 1995. Geomagnetic the drift term varies almost linearly with the axial dipole moment, polarity reversal rate for the Phanerozoic, Geophys. Res. Lett., 22, 231Â­ 234",Geophysical Journal International
38 Geophys. J. Int.-2014-Buffett-597-608.pdf,a.c.kno.wledgements,743,"A C KNO WLEDGEMENTS Risken, H., 1989. The Fokker-Planck Equation, Springer. Schekochihin, A.A., Iskakov, A.B., Cowley, S.C., McWilliams, J.C., Proctor, We thank Richard Holme and an anomymous reviewer for help- M.R.E. &amp; Yousef, T.A., 2007. Fluctuation dynamo and turbulent induction ful comments and suggestions that substantially improved the at low magnetic Prandtl numbers, New J. Phys., 9, doi:10.1088/1367- manuscript. This work is partially support the Miller Institute for 2630/9/8/300. Ba",Geophysical Journal International
38 Geophys. J. Int.-2014-Buffett-597-608.pdf,references,304,"REFERENCES Dyn., 101, 81Â­116. Steenbeck, M., Krause, F. &amp; RÂ¨adler, K.-H., 1966. Berechnung der mit- Braginsky, S.I. &amp; Meytlis, V.P., 1990, Local turbulence in the Earth's core, v Ã— tleren Lorentz-FeldstÂ¨ark B fÂ¨ur ein elektisch leitendes Medium in Geophys. Astrophys. Fluid Dyn., 55, 71Â­87.",Geophysical Journal International
38 Geophys. J. Int.-2014-Buffett-597-608.pdf,x.other.,222,"), although realistic estimates may be much less. Key words: Probability distributions; Dynamo: theories and simulations; Palaeomagnetic secular variation. field is less than the time average, we might expect convection to",Geophysical Journal International
4 Ali Geophys. J. Int.-2010-Ali-557-71.pdf,intr.oduction,10196,"1 INTR ODUCTION Charlotte-Fairweather and Denali fault system; and most impor- Few regions on Earth show the large-scale consequences of sub- tantly from a hazard standpoint, widespread seismicity, including duction as well as those observed in central and southern Alaska the 1964 M9.2 Alaska quake, the second largest earthquake ever (Fig. 1). This area is characterized by rapid uplift of the Alaska, recorded (Kanamori 1977), and the 2002 M7.9 Denali earthquake, Wrangell and St. Elias mountain r",Geophysical Journal International
4 Ali Geophys. J. Int.-2010-Ali-557-71.pdf,a.n.a.ly.s.i.s.a.p.p.roa.c.h,16052,"2 A N A LY S I S A P P ROA C H latitude and 148W longitude, and to the base of the upper mantle at  a depth of 670 km. The 2-D meshes contain 2000 elements and 2.1 Model development also extend to the base of the upper mantle. These models enable us Our analysis utilizes several numerical models, one that con- to explore interseismic and post-seismic modelling approaches and siders the full 3-D geometry and mechanical behaviour of the parameter space in an efficient manner, enabling a more narro",Geophysical Journal International
4 Ali Geophys. J. Int.-2010-Ali-557-71.pdf,r.esul.ts,19215,"3 R ESUL TS Alaska with absolute certainty especially when the GPS velocities are being influenced by transient processes this approach is not fea- 3.1 2-D interseismic models sible. These 2-D results suggest that the modified backslip model We initially explore how the backslip, modified backslip, spin-up works best for calculating interseismic deformation, especially for and weak zone models work to explain observed surface velocities computationally expensive 3-D models. along a 2-D cross-sec",Geophysical Journal International
4 Ali Geophys. J. Int.-2010-Ali-557-71.pdf,stress.ev.ol.ution.cal.culations,8512,"4 STRESS EV OL UTION CAL CULATIONS convergence). Now that we have developed a 3-D numerical model that explains The zone of high shear stresses inboard of the subduction zone the contemporary velocity field, we use this model to calculate the transitions to an even higher shear stress along the transform por- evolution of stress over the past half century. We first consider how tion of the plate boundary (the Fairweather and Queen-Charlotte stressing rates in the Alaskan upper crust are influenc",Geophysical Journal International
4 Ali Geophys. J. Int.-2010-Ali-557-71.pdf,concl.usions,5580,"5 CONCL USIONS Coulomb stress all the way from the plate interface to the Denali We have developed 2-D and 3-D numerical models to calculate how Fault (Fig. 10a), supporting the idea that the Denali fault is a result of partitioning of strain associated with oblique convergence of the interseismic deformation due to relative plate motions, large earth- quakes and post-seismic processes contribute to the contemporary Pacific Plate. Coseismic slip associated with the 1964 earthquake does not signi",Geophysical Journal International
4 Ali Geophys. J. Int.-2010-Ali-557-71.pdf,references,8318,"REFERENCES 142, Sound earthquake: a new geodetic inversion, Pure appl. Geophys., 55Â­82. Aagaard, B., Williams, C. &amp; Knepley, M., 2008. PyLith: a finite-element Hu, Y. Wang, K., He, J., Klotz, J. &amp; Khazaradze, G., 2004. Three- code for modeling quasi-static and dynamic crustal deformation, EOS, 89 dimensional viscoelastic finite element model for post- seismic de- Trans. Am. geophys. Un., (53), Fall Meet. Suppl., Abstract T41A- 109, formation of the great 1960 Chile earthquake, J. geophy",Geophysical Journal International
4 Ali Geophys. J. Int.-2010-Ali-557-71.pdf,x.other.,273,"south of the 1949 rupture surface. Key words: Seismic cycle; Transient deformation; Earthquake interaction, forecasting, and prediction; Continental margins: convergent; Rheology: crust and lithosphere. &gt; largest ( 1000 km) strike-slip faults on Earth, such as the Queen",Geophysical Journal International
